PBW Source ID,Source canonical name,PBW editor,Source edition used,Edition URL,Page range,Editor name,Editor VIAF,Author(ity),Evidence of authorship,External authorship authority,External authorship source,External authorship URL
Albert of Aachen,Historia Hierosolymitana,mj,"Historia Ierosolimitana, History of the Journey to Jerusalem, Oxford 2007",,,"Edgington, Susan B.",93497875,Albert 26101,factoid 432193,,,
Alexios Stoudites,The Decrees of Alexios Stoudites,tp,"Erlasse des Patriarchen von Konstantinopel Alexios Studites, Kiel: Festschrift der Universität Kiel, 1911",https://books.google.at/books/about/Erlasse_des_Patriarchen_von_Konstantinop.html?id=5Qw7AQAAMAAJ&redir_esc=y,,"Ficker, Gerhard",37668465,Alexios 11,"title, p. 4",,,
Alexios Stoudites Eleutherios,Der Häretiker Eleutherius,tp,"“Der Häretiker Eleutherius”, Theologischen Studien und Kritiken 79 (1906): 591-614",https://books.google.at/books/about/Theologische_Studien_und_Kritiken.html?id=NOwfAAAAYAAJ&redir_esc=y,,"Ficker, Gerhard",37668465,Source not available,,,,
Alexios Stoudites Ralles-Potles,Ypomnemata of Alexios Stoudites,tp,"Σύνταγμα τῶν Θείων καὶ Ἱερῶν Κανόνων, vol 5, Athens: G. Kartofylakos, 1855, 20-29.",https://anemi.lib.uoc.gr/php/pdf_pager.php?rec=/metadata/9/3/c/metadata-01-0000374.tkl&do=78487_05.pdf&pageno=41&width=325&height=569&maxpage=654&lang=en,,Ralles Georgios. A.; Potles Michael,10200332; 66864785,Alexios 11,"pp. 20, 25",,,
Alexios Stoudites VV,Psephos of Alexios Stoudites to Theophanes the metropolitan of Thessalonike,tp,"“Ψῆφος τοῦ πατριάρχου κυροῦ Ἀλεξίου πρὸς Θεοφάνην ἐπίσκοπον Θεσσαλονίκης περὶ ἁρπαγῆς γάμου”, Vizantijskij Vremennik 12 (1905) 516-517",https://www.pdf-archive.com/2015/02/20/vizantijskij-vremennik-12-1906/,,"Beneševič, Vladimir N.",88126653,Alexios 11,p. 516,,,
Anna Komnene,Alexias,mj,"Annae Comnenae Alexias, Corpus fontium historiae Byzantinae 40/1, Berlin – New York 2001",,,"Reinsch, Diether Roderich; §§",46774901; 51705268,Anna 62,factoid 437887,,,
Annales Barenses,Annales Barenses,mj,"Annales Barenses, Monumenta Germaniae historica, Scriptores V, Hanover 1844, 52-56",,,"Pertz, Georg Heinrich",54236315,,,,,
Anonymus Barensis,Anonymus Barensis,mj,"Anonymi Barensis Chronicon, Rerum Italicarum scriptores V, Milan 1724, 147-156",,,"Muratori, Lodovico Antonio",68933348,,,,,
Aristakes,Patmutʿiwn,tp; ta,"Récit des malheurs de la nation arménienne, Brussels 1973",,,"Canard, Marius; Pērpērean, Hayk",41837536; 34489376,Aristakes 101,factoid 375021,,,
Aristakes (Armenian),Patmutʿiwn,tp; ta,Patmut'iwn Aristakisi Lastivertc'woy,,,"Juzbašjan, K.N.",91775959,Aristakes 101,factoid 375021,,,
Attaleiates: Diataxis,Diataxis,tp,"“La diataxis de Michel Attaliate”, Revue des études byzantines 39 (1981) 5-143",,,"Gautier, Paul",231073465,Michael 202,factoid 254236,,,
Attaleiates: History,Attaliatae Historia,tp,"Michaelis Attaliatae Historia, Corpus scriptorum historiae Byzantinae 3, Bonn 1853",,,"Brunet de Presle, Wladimir; Bekker, Immanuel",203410427; 44387193,Michael 202,factoid 235092,,,
Attaleiates: History (Spanish),Attaliatae Historia,tp,"Miguel Attaliates Historia, Nueva Roma. Bibliotheca Graeca et Latina Aevi Posterioris 15, Madrid 2002",,,"Pérez Martín, Inmaculada",12526036,Michael 202,factoid 235092,,,
"Basilakios, Orationes et epistulae",Basilacae Orationes et epistolae,,"Nicephori Basilacae Orationes et epistolae, Leipzig 1984",http://digital.slub-dresden.de/id416081606,,"Garzya, Antonio",27081575,Nikephoros 17003,factoid 437070,,,
Boilas,Testament of Boilas,mj,"“Le testament d’Eustathios Boïlas (Avril 1059)”, Cinq études sur le XIe siècle byzantin, Paris (1977) 15-63",,,"Lemerle, Paul",97996834,Eustathios 105,factoid 226498,,,
Bryennios,Hyle historias,tp,"Nicéphore Bryennios: Histoire. Introduction, texte, traduction et notes, Brussels 1975",,,"Gautier, Paul",231073465,Nikephoros 117,factoid 237218,,,
Christophoros of Mitylene,Poems,mj,"Die Gedichte des Christophoros Mitylenaios, Leipzig 1903",https://archive.org/embed/diegedichtedesch00chriuoft,,"Kurtz, Eduard",59840374,Christophoros 13102,"title, p. 1",,,
"Christos Philanthropos, note",n/a,mj,"“Commémoraisons des Comnènes dans le typikon liturgique du monastère du Christ Philanthrope (ms. Panaghia Kamariotissa 29)”, Revue des études Byzantines 63 (2005), 41-69",https://www.persee.fr/doc/rebyz_0766-5598_2005_num_63_1_2305,,"Rízou-Kouroúpou, Matoúla; Vannier, Jean-François",102334712; 219220697,,,,,
Chrysobull of 1079,n/a,tp,"“Un chrysobulle de Nicéphore Botaneiatès à souscription synodale”, Byzantion 29 (1959) 29-41",https://www.jstor.org/stable/44169005,,"Gouillard, Jean",88739139,Nikephoros 3,factoid 224945,,,
Clement III to Basileios of Calabria,Clement III to Basileios of Calabria,jr,"“Die Unionsverhandlungen zwischen Kaiser Alexios I. und Papst Urban II. im Jahre 1089″, Byzantinische Zeitschrift 28 (1928), 59-60",https://doi.org/10.1515/byzs.1928.28.1.38,,"Holtzmann, Walther",7485449,Klemes 23,factoid 444557,,,
Dionysiou,Deed of guarantee of Konstantinos Phasoulos,tp,"Actes de Dionysiou, Archives de l’Athos IV, Paris 1968, pp. 35-42",https://archive.org/details/Archives-De-Athos/Archives%20de%20l%27Athos%204-Actes%20de%20Dionysiou%2C%20ed.%20N.%20Oikonomides%2C%20Paris%201968/,,"Oikonomidēs, Nicolas",14774616,Ioannes 411,factoid 375306,,,
Docheiariou 1,Hypomnema of Konstantinos Kamateros,tp,"Actes de Docheiariou, Archives de l’Athos XIII, Paris 1984, 53",https://archive.org/details/Archives-De-Athos/Archives%20de%20l%27Athos%2013-Actes%20de%20Docheiariou%2C%20ed.%20N.%20Oikonomid%E5%A6%94%2C%20Paris%201984,53,"Oikonomidēs, Nicolas",14774616,Konstantinos 256,factoid 375484,,,
Docheiariou 2,Imperial letters of Alexios and Anna,tp,"Actes de Docheiariou, Archives de l’Athos XIII, Paris 1984, 58-59",https://archive.org/details/Archives-De-Athos/Archives%20de%20l%27Athos%2013-Actes%20de%20Docheiariou%2C%20ed.%20N.%20Oikonomid%E5%A6%94%2C%20Paris%201984,"58.1,58.40","Oikonomidēs, Nicolas",14774616,Niketas 159,factoid 375495,,,
Docheiariou 2a,Pittakion of Alexios I,tp,"Actes de Docheiariou, Archives de l’Athos XIII, Paris 1984, 58",https://archive.org/details/Archives-De-Athos/Archives%20de%20l%27Athos%2013-Actes%20de%20Docheiariou%2C%20ed.%20N.%20Oikonomid%E5%A6%94%2C%20Paris%201984,58.2-19,"Oikonomidēs, Nicolas",14774616,Niketas 159; Alexios 1,factoid 375495,,,
Docheiariou 2b,Prostaxis of Anna Dalassene,tp,"Actes de Docheiariou, Archives de l’Athos XIII, Paris 1984, 58-59",https://archive.org/details/Archives-De-Athos/Archives%20de%20l%27Athos%2013-Actes%20de%20Docheiariou%2C%20ed.%20N.%20Oikonomid%E5%A6%94%2C%20Paris%201984,"58.20-21,59.21-39","Oikonomidēs, Nicolas",14774616,Niketas 159; Anna 61,factoid 375495,,,
Documents 4,On Ordinations,jr,"Documents inédits d'ecclésiologie byzantine, Leuven 1966, pp. 176-206",,176-206,"Darrouzès, Jean",19676388,Niketas 135,factoid 444823,,,
Documents 5,On Synods,jr,"Documents inédits d'ecclésiologie byzantine, Leuven 1966, pp. 208-236",,208-236,"Darrouzès, Jean",19676388,Niketas 135,factoid 444821,,,
Documents 6,On Elections,jr,"Documents inédits d'ecclésiologie byzantine, Leuven 1966, pp. 238-248",,238-248,"Darrouzès, Jean",19676388,Niketas 135,factoid 444837,,,
Documents 7,On Resignations,jr,"Documents inédits d'ecclésiologie byzantine, Leuven 1966, pp. 250-264",,250-264,"Darrouzès, Jean",19676388,Niketas 135,factoid 444841,,,
Domenico of Grado,Domenico of Grado to Petros of Antioch,jr,"Acta et scripta quae de controversiis ecclesiae graecae et latinae saeculo undecimo composita extant, Leipzig and Marburg 1861, pp. 205-208","https://www.digitale-sammlungen.de/en/view/bsb10800693?page=,1",,"Will, Cornelius",29618378,Dominikos 101,factoid 434887,,,
Eleousa: Acts,Chrysobull to Eleousa monastery,tp,"“Le monastère de Notre-Dame de Pitié en Macédoine”, Izvestija Russkogo Arheologičeskogo Instituta v Konstantinopole 6 (1900) 25-27",https://athoslibrary.blogspot.com/2021/08/petit-louis-le-monastere-de-notre-dame.html,,"Petit, Louis",51721803,Alexios 1,factoid 254102,,,
Eleousa: Typikon,Typikon of Eleousa monastery,mw,"“Le monastère de Notre-Dame de Pitié en Macédoine”, Izvestija Russkogo Arheologičeskogo Instituta v Konstantinopole 6 (1900) 69-125",https://athoslibrary.blogspot.com/2021/08/petit-louis-le-monastere-de-notre-dame.html,,"Petit, Louis",51721803,Manuel 63,factoid 240569,,,
Esphigmenou 1,Deed of sale 1034,tp,"Actes d’Esphigménou, Archives de l’Athos VI, Paris 1973, 41-42",https://archive.org/details/Archives-De-Athos/Archives%20de%20l%27Athos%206-Actes%20d%27Esphigm%E4%BF%B7ou%2C%20ed.%20J.%20Lefort%2C%20Paris%201973,41-42,"Lefort, Jacques",71393851,Dionysios 110; Germanos 108; Petros 139,factoid 375406,,,
Esphigmenou 2,Deed of Theoktistos to Nikephoros,tp,"Actes d’Esphigménou, Archives de l’Athos VI, Paris 1973, 45-46",https://archive.org/details/Archives-De-Athos/Archives%20de%20l%27Athos%206-Actes%20d%27Esphigm%E4%BF%B7ou%2C%20ed.%20J.%20Lefort%2C%20Paris%201973,45-46,"Lefort, Jacques",71393851,Bartholomaios 108; Theoktistos 107,factoid 375433,,,
Esphigmenou 3,Guarantee of Theodoros of Galaiagra,tp,"Actes d’Esphigménou, Archives de l’Athos VI, Paris 1973, 48-49",https://archive.org/details/Archives-De-Athos/Archives%20de%20l%27Athos%206-Actes%20d%27Esphigm%E4%BF%B7ou%2C%20ed.%20J.%20Lefort%2C%20Paris%201973,48-49,"Lefort, Jacques",71393851,Theodoros 224; Iakobos 101,factoid 375439,,,
Esphigmenou 4,Deed of Nikolaos protospatharios,tp,"Actes d’Esphigménou, Archives de l’Athos VI, Paris 1973, 52-54",https://archive.org/details/Archives-De-Athos/Archives%20de%20l%27Athos%206-Actes%20d%27Esphigm%E4%BF%B7ou%2C%20ed.%20J.%20Lefort%2C%20Paris%201973,"52.1-2,53.12-29,54.30","Lefort, Jacques",71393851,Nikolaos 226,factoid 375458,,,
Esphigmenou 4a,Parekbolaion of Christophoros krites,tp,"Actes d’Esphigménou, Archives de l’Athos VI, Paris 1973, 52-53",https://archive.org/details/Archives-De-Athos/Archives%20de%20l%27Athos%206-Actes%20d%27Esphigm%E4%BF%B7ou%2C%20ed.%20J.%20Lefort%2C%20Paris%201973,"52.3-6,53.6-11","Lefort, Jacques",71393851,Christophoros 110; Nikolaos 226,factoid 375454,,,
Esphigmenou 5,Deed of Euthymios,tp,"Actes d’Esphigménou, Archives de l’Athos VI, Paris 1973, 57-58",https://archive.org/details/Archives-De-Athos/Archives%20de%20l%27Athos%206-Actes%20d%27Esphigm%E4%BF%B7ou%2C%20ed.%20J.%20Lefort%2C%20Paris%201973,57-58,"Lefort, Jacques",71393851,Euthymios 113,factoid 375483,,,
Eustathios Romaios Peira,Peira,mj,"“Πεῖρα Εὐσταθίου τοῦ Ῥωμαίου”, Jus Graecoromanum vol.4, Athens 1931",,,"Zepos, Panagiōtēs",111939078,"Eustathios 61, Anonymus 12144",factoid 374065,,,
Eustathios Romaios RPA,Peri disexadelphōn,mj,"Σύνταγμα τῶν θείων καὶ ἱερῶν κανόνων, vol. 5, Athens 1855, 32-36",https://anemi.lib.uoc.gr/metadata/9/3/c/metadata-01-0000374.tkl,32-36,"Rállēs, Geṓrgios A.; Potlēs, Michaēl",10200332; 66864785,Eustathios 61,factoid 374072,,,
Eustathios Romaios RPB,Hypomnēma peri duō exadelphōn labontōn duo exadelphas,mj,"Σύνταγμα τῶν θείων καὶ ἱερῶν κανόνων, vol. 5, Athens 1855, 341-353",https://anemi.lib.uoc.gr/metadata/9/3/c/metadata-01-0000374.tkl,341-353,"Rállēs, Geṓrgios A.; Potlēs, Michaēl",10200332; 66864785,Eustathios 61,factoid 374067,,,
Eustathios Romaios Schminck I,,mj,"“Vier eherechtliche Entscheidungen aus dem 11. Jahrhundert”, Fontes Minores 3 (1979) 221-279",,,"Schminck, Andreas",62165959,Eustathios 61,factoid 374068,,,
Eustathios Romaios Schminck II,,mj,"“Vier eherechtliche Entscheidungen aus dem 11. Jahrhundert”, Fontes Minores 3 (1979) 221-279",,,"Schminck, Andreas",62165959,Eustathios 61,,,,
Eustathios Romaios Schminck III,,mj,"“Vier eherechtliche Entscheidungen aus dem 11. Jahrhundert”, Fontes Minores 3 (1979) 221-279",,,"Schminck, Andreas",62165959,Eustathios 61,factoid 374070,,,
Eustathios: Capture of Thessalonike,De Thessalonica a Latinis capta,mj,"La espugnazione di Tessalonica, Palermo 1961",,,"Kyriakides, Stilpon Paraskeua",69687416,Eustathios 20147,factoid 451468,,,
Fulcher of Chartres,Fulcheri Carnotensis Historia Hierosolymitana,mj,"Fulcheri Carnotensis Historia Hierosolymitana (1095-1127), Heidelberg 1913",https://archive.org/details/historiahierosol00foucuoft,,"Hagenmeyer, Heinrich",5023204,Fulcher 101,factoid 442407,,,
Glykas,Annales,tp,"Michaelis Glycae Annales, Corpus scriptorum historiae Byzantinae 21, Bonn 1836",https://archive.org/details/michaelisglycae00leungoog,,"Bekker, Immanuel",44387193,Michael 305,"Vol. 4, col. 1519",Peter Schreiner,"Glykas Sikidites, Michael', in Lexikon des Mittelalters, 10 vols (Stuttgart: Metzler, [1977]-1999)",http://apps.brepolis.net.uaccess.univie.ac.at/lexiema/test/Default2.aspx
"Gregory VII, Epistolae vagantes",Gregory VII to Matilda of Tuscany,jr,"The Epistolae vagantes of Pope Gregory VII, Oxford 1972",https://archive.org/details/epistolaevagante0000cath/,,"Cowdrey, Herbert E. J.",2787145857122522922479,Gregorios 27,factoid 444761,,,
"Gregory VII, in Caspar I, 18",Gregory VII to Emperor Michael VII,jr,"Das Register Gregors VII, in Monumenta Germaniae historica. Epistolae selectae, 2 vols., Berlin 1920-1923",https://archive.org/details/dasregistergrego00cath,,"Caspar, Erich Ludwig Eduard",10598157,Gregorios 27,factoid 444762,,,
"Gregory VII, in Caspar I, 46",Gregory VII to William of Burgundy,jr,"Das Register Gregors VII, in Monumenta Germaniae historica. Epistolae selectae, 2 vols., Berlin 1920-1924",https://archive.org/details/dasregistergrego00cath,,"Caspar, Erich Ludwig Eduard",10598157,Gregorios 27,factoid 444763,,,
"Gregory VII, in Caspar I, 49",Gregory VII's call for the defense of Constantinople,jr,"Das Register Gregors VII, in Monumenta Germaniae historica. Epistolae selectae, 2 vols., Berlin 1920-1925",https://archive.org/details/dasregistergrego00cath,,"Caspar, Erich Ludwig Eduard",10598157,Gregorios 27,factoid 444764,,,
"Gregory VII, in Caspar II, 31",Gregory VII to Henry IV,jr,"Das Register Gregors VII, in Monumenta Germaniae historica. Epistolae selectae, 2 vols., Berlin 1920-1926",https://archive.org/details/dasregistergrego00cath,,"Caspar, Erich Ludwig Eduard",10598157,Gregorios 27,factoid 444765,,,
"Gregory VII, in Caspar II, 37",Gregory VII's call for the crussade,jr,"Das Register Gregors VII, in Monumenta Germaniae historica. Epistolae selectae, 2 vols., Berlin 1920-1927",https://archive.org/details/dasregistergrego00cath,,"Caspar, Erich Ludwig Eduard",10598157,Gregorios 27,factoid 444766,,,
"Gregory VII, in Caspar II, 49","Gregory VII to Hugh, Abbot of Cluny",jr,"Das Register Gregors VII, in Monumenta Germaniae historica. Epistolae selectae, 2 vols., Berlin 1920-1928",https://archive.org/details/dasregistergrego00cath,,"Caspar, Erich Ludwig Eduard",10598157,Gregorios 27,factoid 444767,,,
"Gregory VII, in Caspar II, 6","Gregory VII to Jaromir, Bishop of Prague",jr,"Das Register Gregors VII, in Monumenta Germaniae historica. Epistolae selectae, 2 vols., Berlin 1920-1929",https://archive.org/details/dasregistergrego00cath,,"Caspar, Erich Ludwig Eduard",10598157,Gregorios 27,factoid 444768,,,
"Gregory VII, in Caspar II, 52a","Short report on the Roman Synod, 1075",jr,"Das Register Gregors VII, in Monumenta Germaniae historica. Epistolae selectae, 2 vols., Berlin 1920-1930",https://archive.org/details/dasregistergrego00cath,,"Caspar, Erich Ludwig Eduard",10598157,Gregorios 27,factoid 444769,,,
"Gregory VII, in Caspar VI, 5b","Protocol of the Roman Synod, Fall 1078",jr,"Das Register Gregors VII, in Monumenta Germaniae historica. Epistolae selectae, 2 vols., Berlin 1920-1931",https://archive.org/details/dasregistergrego00cath,,"Caspar, Erich Ludwig Eduard",10598157,Gregorios 27,factoid 444770,,,
"Gregory VII, in Caspar VII, 28","Gregory VII to Roffredo, Bishop of Benevento",jr,"Das Register Gregors VII, in Monumenta Germaniae historica. Epistolae selectae, 2 vols., Berlin 1920-1932",https://archive.org/details/dasregistergrego00cath,,"Caspar, Erich Ludwig Eduard",10598157,Gregorios 27,factoid 444771,,,
"Gregory VII, in Caspar VIII, 1","Gregory VII to Gregory, Archbishop of Armenia",jr,"Das Register Gregors VII, in Monumenta Germaniae historica. Epistolae selectae, 2 vols., Berlin 1920-1933",https://archive.org/details/dasregistergrego00cath,,"Caspar, Erich Ludwig Eduard",10598157,Gregorios 27,factoid 444772,,,
"Gregory VII, in Caspar VIII, 1a",Robert Guiscard's Loyalty Oath to Gregory VII,jr,"Das Register Gregors VII, in Monumenta Germaniae historica. Epistolae selectae, 2 vols., Berlin 1920-1934",https://archive.org/details/dasregistergrego00cath,,"Caspar, Erich Ludwig Eduard",10598157,Gregorios 27,factoid 444773,,,
"Gregory VII, in Caspar VIII, 1b",Robert Guiscard's Investiture by Gregory VII,jr,"Das Register Gregors VII, in Monumenta Germaniae historica. Epistolae selectae, 2 vols., Berlin 1920-1935",https://archive.org/details/dasregistergrego00cath,,"Caspar, Erich Ludwig Eduard",10598157,Gregorios 27,factoid 444774,,,
"Gregory VII, in Caspar VIII, 6",Gregory VII's Call to the Southern Italian Bishops for the Support of Emperor Michael VII,jr,"Das Register Gregors VII, in Monumenta Germaniae historica. Epistolae selectae, 2 vols., Berlin 1920-1936",https://archive.org/details/dasregistergrego00cath,,"Caspar, Erich Ludwig Eduard",10598157,Gregorios 27,factoid 444775,,,
"Gregory VII, in Caspar IX, 17",Gregory VII to Robert Guiscard,jr,"Das Register Gregors VII, in Monumenta Germaniae historica. Epistolae selectae, 2 vols., Berlin 1920-1937",https://archive.org/details/dasregistergrego00cath,,"Caspar, Erich Ludwig Eduard",10598157,Gregorios 27,factoid 444776,,,
Hilandar,Act of Paul protos,tp,"Actes de Chilandar I. Des origines à 1319, Archives de l’Athos XX, Paris 1998, 98-99",https://archive.org/details/Archives-De-Athos/Archives%20de%20l%27Athos%2020-Actes%20de%20Chilandar-tom%201%2C%20eds.%20M.%20%C5%BDivojinovi%C4%87%2C%20V.%20Kravari%2C%20C.%20Giros%2C%20Paris%201998,,"Živojinović, Mirjana; Kravari, Vassiliki; Giros, Christophe",14898912; 31154757; 24760554,Paulos 105; Nikephoros 170,factoid 375616,,,
"Humbert, Commemoratio","Humbert, Commemoratio",ju,"Acta et scripta quae de controversiis ecclesiae graecae et latinae saeculo undecimo composita extant, Leipzig and Marburg 1861, pp. 150-52","https://www.digitale-sammlungen.de/en/view/bsb10800693?page=,1",,"Will, Cornelius",29618378,Humbert 101,,,,
"Humbert, Excommunication","Humbert, Excommunication",ju,"Acta et scripta quae de controversiis ecclesiae graecae et latinae saeculo undecimo composita extant, Leipzig and Marburg 1861, pp. 153-54","https://www.digitale-sammlungen.de/en/view/bsb10800693?page=,1",,"Will, Cornelius",29618378,Humbert 101,factoid 435209,,,
Hypomnema on marriage,Hypomnema on marriage,mj,"“Vier eherechtliche Entscheidungen aus dem 11. Jahrhundert”, Fontes Minores 3 (1979) 221-279",,,"Schminck, Andreas",62165959,Eustathios 61,,,,
Ibn Shaddad,Al-a'laq al-khatira fi dhikr umara' al-Sham wa'l-Jazira,bs; hm,"La description de la Syrie du Nord de ‘Izz al-Din Ibn Saddad” (Ibn Shaddad, al-A’laq al-khatira fi dhikr umara’ al-Sham wa-l-Jazira, al-juz’ al-awwal, al-qism al-thani), Bulletin d’études orientales 32-33 (1980-81), 265-402",https://books.openedition.org/ifpo/4946,,"Eddé, Anne-Marie",17250992,Ibn Shaddad,Introduction,Anne-Marie Eddé-Terrasse ,"La description de la Syrie du Nord de ‘Izz al-Din Ibn Saddad” (Ibn Shaddad, al-A’laq al-khatira fi dhikr umara’ al-Sham wa-l-Jazira, al-juz’ al-awwal, al-qism al-thani), Bulletin d’études orientales 32-33 (1980-81), 265-402",https://books.openedition.org/ifpo/4946
Ibn al-Athir,al-Kamil fi'l-Ta'rikh',wa,"The Chronicle of Ibn al-Athir for the Crusading Period from al-Kamil fi'l-Ta'rikh, London 2008:",-,,"Richards, D. S.",112702543,Ibn al-Athir ,page 288-289,Ibn Khallikan,Ibn Khallikan's Biographical Dictionary,https://archive.org/details/ibnkhallikansbi00slangoog/page/288/mode/2up
Italos trial,,mj,"“Le proces officiel de Jean l’Italien: les actes et leurs sous-entendus,” Travaux et Memoires 9 (1985), 133-69",https://archive.org/details/tm-20.2-2016-melanges-catherine-jolivet-levy/TM%2009%20%281985%29/page/n145/mode/2up,,"Gouillard, Jean",88739139,,,,,
Iveron 25,Testament of Loukas of Galeagra,tp,"Actes d’Iviron I, Actes de l’Athos XIV, Paris 1985, 237-239",https://archive.org/details/Archives-De-Athos/Archives%20de%20l%27Athos%2014-Actes%20d%27Iviron-tome%201%2C%20eds.%20J.%20Lefort%2C%20N.%20Oikonomid%E5%A6%94%2C%20D.%20Papachryssanthou%2C%20H.%20Metreveli%2C%20Paris%201985,1.237-239,"Lefort, Jacques; Oikonomidès, Nicolas; Papachryssanthou, Denise; Métrévéli, Hélène",71393851; 14774616; 93206983; 59302266,Loukas 102; Iakobos 101,factoid 219505,,,
Iveron 26,Act of exchange,tp,"Actes d’Iviron I, Actes de l’Athos XIV, Paris 1985, 241-243",https://archive.org/details/Archives-De-Athos/Archives%20de%20l%27Athos%2014-Actes%20d%27Iviron-tome%201%2C%20eds.%20J.%20Lefort%2C%20N.%20Oikonomid%E5%A6%94%2C%20D.%20Papachryssanthou%2C%20H.%20Metreveli%2C%20Paris%201985/mode/2up,1.241-243,"Lefort, Jacques; Oikonomidès, Nicolas; Papachryssanthou, Denise; Métrévéli, Hélène",71393851; 14774616; 93206983; 59302266,Maria 107; Anna 103; Agathe 101; Niketas 121,factoid 217609,,,
Iveron 27,Act of delimitation,tp,"Actes d’Iviron I, Actes de l’Athos XIV, Paris 1985, 245-247",https://archive.org/details/Archives-De-Athos/Archives%20de%20l%27Athos%2014-Actes%20d%27Iviron-tome%201%2C%20eds.%20J.%20Lefort%2C%20N.%20Oikonomid%E5%A6%94%2C%20D.%20Papachryssanthou%2C%20H.%20Metreveli%2C%20Paris%201986,1.245-247,"Lefort, Jacques; Oikonomidès, Nicolas; Papachryssanthou, Denise; Métrévéli, Hélène",71393851; 14774616; 93206983; 59302266,Theodosios 106,factoid 217644,,,
Iveron 28,Act of Markos,tp,"Actes d’Iviron I, Actes de l’Athos XIV, Paris 1985, 249-251",https://archive.org/details/Archives-De-Athos/Archives%20de%20l%27Athos%2014-Actes%20d%27Iviron-tome%201%2C%20eds.%20J.%20Lefort%2C%20N.%20Oikonomid%E5%A6%94%2C%20D.%20Papachryssanthou%2C%20H.%20Metreveli%2C%20Paris%201985/mode/2up,1.249-251,"Lefort, Jacques; Oikonomidès, Nicolas; Papachryssanthou, Denise; Métrévéli, Hélène",71393851; 14774616; 93206983; 59302266,Markos 101; Basileios 121,factoid 217661,,,
Iveron 29,Act of Andronikos anagrapheus,tp,"Actes d’Iviron I, Actes de l’Athos XIV, Paris 1985, 256-261",https://archive.org/details/Archives-De-Athos/Archives%20de%20l%27Athos%2014-Actes%20d%27Iviron-tome%201%2C%20eds.%20J.%20Lefort%2C%20N.%20Oikonomid%E5%A6%94%2C%20D.%20Papachryssanthou%2C%20H.%20Metreveli%2C%20Paris%201987,1.256-261,"Lefort, Jacques; Oikonomidès, Nicolas; Papachryssanthou, Denise; Métrévéli, Hélène",71393851; 14774616; 93206983; 59302266,Andronikos 104,factoid 217687,,,
Iveron 30,Extract of Gregorios Chalkoutzes,tp,"Actes d’Iviron I, Actes de l’Athos XIV, Paris 1985, 268-270",https://archive.org/details/Archives-De-Athos/Archives%20de%20l%27Athos%2014-Actes%20d%27Iviron-tome%201%2C%20eds.%20J.%20Lefort%2C%20N.%20Oikonomid%E5%A6%94%2C%20D.%20Papachryssanthou%2C%20H.%20Metreveli%2C%20Paris%201985/mode/2up,1.268-270,"Lefort, Jacques; Oikonomidès, Nicolas; Papachryssanthou, Denise; Métrévéli, Hélène",71393851; 14774616; 93206983; 59302266,Gregorios 117,factoid 217689,,,
Iveron 31,Act of Leon Thylakas,tp,"Actes d’Iviron II, Actes de l’Athos XVI, Paris 1990, 77-80",https://archive.org/details/Archives-De-Athos/Archives%20de%20l%27Athos%2016-Actes%20d%27Iviron-tome%202%2C%20eds.%20%20J.%20Lefort%2C%20N.%20Oikonomid%E5%A6%94%2C%20D.%20Papachryssanthou%2C%20V.%20Kravari%2C%20H.%20Metreveli%2C%20Paris%201990,"2.77.1,2.77.13-15,2.78.15-26,2.79.40,2.79.45,2.79.50,2.80.51-61","Lefort, Jacques; Oikonomidès, Nicolas; Papachryssanthou, Denise; Kravari, Vassiliki; Métrévéli, Hélène;",71393851; 14774616; 93206983; 31154757; 59302266,Leon 119; Ioannes 160,factoid 217797,,,
Iveron 31a,Decree of Theodora,tp,"Actes d’Iviron II, Actes de l’Athos XVI, Paris 1990, 77",https://archive.org/details/Archives-De-Athos/Archives%20de%20l%27Athos%2016-Actes%20d%27Iviron-tome%202%2C%20eds.%20%20J.%20Lefort%2C%20N.%20Oikonomid%E5%A6%94%2C%20D.%20Papachryssanthou%2C%20V.%20Kravari%2C%20H.%20Metreveli%2C%20Paris%201990,2.77.2-13,"Lefort, Jacques; Oikonomidès, Nicolas; Papachryssanthou, Denise; Kravari, Vassiliki; Métrévéli, Hélène;",71393851; 14774616; 93206983; 31154757; 59302266,Theodora 1; Ioannes 160,factoid 217735,,,
Iveron 31b,Decree of Theodora,tp,"Actes d’Iviron II, Actes de l’Athos XVI, Paris 1990, 78-79",https://archive.org/details/Archives-De-Athos/Archives%20de%20l%27Athos%2016-Actes%20d%27Iviron-tome%202%2C%20eds.%20%20J.%20Lefort%2C%20N.%20Oikonomid%E5%A6%94%2C%20D.%20Papachryssanthou%2C%20V.%20Kravari%2C%20H.%20Metreveli%2C%20Paris%201990,"2.78.27-31,2.79.31-39","Lefort, Jacques; Oikonomidès, Nicolas; Papachryssanthou, Denise; Kravari, Vassiliki; Métrévéli, Hélène;",71393851; 14774616; 93206983; 31154757; 59302266,Theodora 1; Ioannes 160,factoid 217781,,,
Iveron 31c,Response of the protos,tp,"Actes d’Iviron II, Actes de l’Athos XVI, Paris 1990, 79",https://archive.org/details/Archives-De-Athos/Archives%20de%20l%27Athos%2016-Actes%20d%27Iviron-tome%202%2C%20eds.%20%20J.%20Lefort%2C%20N.%20Oikonomid%E5%A6%94%2C%20D.%20Papachryssanthou%2C%20V.%20Kravari%2C%20H.%20Metreveli%2C%20Paris%201990,2.79.41-44,"Lefort, Jacques; Oikonomidès, Nicolas; Papachryssanthou, Denise; Kravari, Vassiliki; Métrévéli, Hélène;",71393851; 14774616; 93206983; 31154757; 59302266,Hilarion 101; Ioannes 160,factoid 217785,,,
